{
  "id": "fr-toulon",
  "name": "Toulon",
  "proper": "Toulon Naval Base",
  "type": "naval_base",
  "country": "France",
  "operator": "French Navy",
  "bounds": {
    "north": 43.164,
    "south": 43.064,
    "east": 5.968,
    "west": 5.868
  },
  "center": {
    "lat": 43.114000000000004,
    "lon": 5.918
  },
  "carriers": [
    "fr-charles-de-gaulle",
    "fr-dixmude",
    "fr-mistral",
    "fr-tonnerre"
  ]
}
