{
  "id": "es-rota",
  "name": "Rota",
  "proper": "Naval Station Rota",
  "type": "naval_base",
  "country": "Spain",
  "operator": "Spanish Navy",
  "bounds": {
    "north": 36.62978706112516,
    "south": 36.608672522366135,
    "east": -6.322503089904785,
    "west": -6.3378238677978525
  },
  "center": {
    "lat": 36.619229791745646,
    "lon": -6.330163478851318
  },
  "carriers": [
    "es-juan-carlos-i"
  ]
}
